{
  "schema_version": "0.1.0",
  "registry_version": "0.1.0",
  "thinker_id": "TH.PLATO",
  "registry_status": "PARTIAL_FROZEN",
  "deferred_scopes": [
    "EPIGRAMMATA_MEMBERS"
  ],
  "entries": [
    {
      "semantic_id": "TH.PLATO.WORK.EUTHYPHRO",
      "catalog_id": "TH.PLATO.CAT.EUTHYPHRO",
      "code": "EUTHYPHRO",
      "entity_kind": "WORK",
      "code_status": "FROZEN",
      "title_snapshot": "Euthyphro",
      "survival_status": "EXTANT",
      "runtime_candidacy": "TEXT_CANDIDATE"
    },
    {
      "semantic_id": "TH.PLATO.WORK.APOLOGY",
      "catalog_id": "TH.PLATO.CAT.APOLOGY",
      "code": "APOLOGY",
      "entity_kind": "WORK",
      "code_status": "FROZEN",
      "title_snapshot": "Apology of Socrates",
      "survival_status": "EXTANT",
      "runtime_candidacy": "TEXT_CANDIDATE"
    },
    {
      "semantic_id": "TH.PLATO.WORK.CRITO",
      "catalog_id": "TH.PLATO.CAT.CRITO",
      "code": "CRITO",
      "entity_kind": "WORK",
      "code_status": "FROZEN",
      "title_snapshot": "Crito",
      "survival_status": "EXTANT",
      "runtime_candidacy": "TEXT_CANDIDATE"
    },
    {
      "semantic_id": "TH.PLATO.WORK.PHAEDO",
      "catalog_id": "TH.PLATO.CAT.PHAEDO",
      "code": "PHAEDO",
      "entity_kind": "WORK",
      "code_status": "FROZEN",
      "title_snapshot": "Phaedo",
      "survival_status": "EXTANT",
      "runtime_candidacy": "TEXT_CANDIDATE"
    },
    {
      "semantic_id": "TH.PLATO.WORK.CRATYLUS",
      "catalog_id": "TH.PLATO.CAT.CRATYLUS",
      "code": "CRATYLUS",
      "entity_kind": "WORK",
      "code_status": "FROZEN",
      "title_snapshot": "Cratylus",
      "survival_status": "EXTANT",
      "runtime_candidacy": "TEXT_CANDIDATE"
    },
    {
      "semantic_id": "TH.PLATO.WORK.THEAETETUS",
      "catalog_id": "TH.PLATO.CAT.THEAETETUS",
      "code": "THEAETETUS",
      "entity_kind": "WORK",
      "code_status": "FROZEN",
      "title_snapshot": "Theaetetus",
      "survival_status": "EXTANT",
      "runtime_candidacy": "TEXT_CANDIDATE"
    },
    {
      "semantic_id": "TH.PLATO.WORK.SOPHIST",
      "catalog_id": "TH.PLATO.CAT.SOPHIST",
      "code": "SOPHIST",
      "entity_kind": "WORK",
      "code_status": "FROZEN",
      "title_snapshot": "Sophist",
      "survival_status": "EXTANT",
      "runtime_candidacy": "TEXT_CANDIDATE"
    },
    {
      "semantic_id": "TH.PLATO.WORK.STATESMAN",
      "catalog_id": "TH.PLATO.CAT.STATESMAN",
      "code": "STATESMAN",
      "entity_kind": "WORK",
      "code_status": "FROZEN",
      "title_snapshot": "Statesman",
      "survival_status": "EXTANT",
      "runtime_candidacy": "TEXT_CANDIDATE"
    },
    {
      "semantic_id": "TH.PLATO.WORK.PARMENIDES",
      "catalog_id": "TH.PLATO.CAT.PARMENIDES",
      "code": "PARMENIDES",
      "entity_kind": "WORK",
      "code_status": "FROZEN",
      "title_snapshot": "Parmenides",
      "survival_status": "EXTANT",
      "runtime_candidacy": "TEXT_CANDIDATE"
    },
    {
      "semantic_id": "TH.PLATO.WORK.PHILEBUS",
      "catalog_id": "TH.PLATO.CAT.PHILEBUS",
      "code": "PHILEBUS",
      "entity_kind": "WORK",
      "code_status": "FROZEN",
      "title_snapshot": "Philebus",
      "survival_status": "EXTANT",
      "runtime_candidacy": "TEXT_CANDIDATE"
    },
    {
      "semantic_id": "TH.PLATO.WORK.SYMPOSIUM",
      "catalog_id": "TH.PLATO.CAT.SYMPOSIUM",
      "code": "SYMPOSIUM",
      "entity_kind": "WORK",
      "code_status": "FROZEN",
      "title_snapshot": "Symposium",
      "survival_status": "EXTANT",
      "runtime_candidacy": "TEXT_CANDIDATE"
    },
    {
      "semantic_id": "TH.PLATO.WORK.PHAEDRUS",
      "catalog_id": "TH.PLATO.CAT.PHAEDRUS",
      "code": "PHAEDRUS",
      "entity_kind": "WORK",
      "code_status": "FROZEN",
      "title_snapshot": "Phaedrus",
      "survival_status": "EXTANT",
      "runtime_candidacy": "TEXT_CANDIDATE"
    },
    {
      "semantic_id": "TH.PLATO.WORK.ALCIBIADES_I",
      "catalog_id": "TH.PLATO.CAT.ALCIBIADES_I",
      "code": "ALCIBIADES_I",
      "entity_kind": "WORK",
      "code_status": "FROZEN",
      "title_snapshot": "Alcibiades I",
      "survival_status": "EXTANT",
      "runtime_candidacy": "TEXT_CANDIDATE"
    },
    {
      "semantic_id": "TH.PLATO.WORK.ALCIBIADES_II",
      "catalog_id": "TH.PLATO.CAT.ALCIBIADES_II",
      "code": "ALCIBIADES_II",
      "entity_kind": "WORK",
      "code_status": "FROZEN",
      "title_snapshot": "Alcibiades II",
      "survival_status": "EXTANT",
      "runtime_candidacy": "TEXT_CANDIDATE"
    },
    {
      "semantic_id": "TH.PLATO.WORK.HIPPARCHUS",
      "catalog_id": "TH.PLATO.CAT.HIPPARCHUS",
      "code": "HIPPARCHUS",
      "entity_kind": "WORK",
      "code_status": "FROZEN",
      "title_snapshot": "Hipparchus",
      "survival_status": "EXTANT",
      "runtime_candidacy": "TEXT_CANDIDATE"
    },
    {
      "semantic_id": "TH.PLATO.WORK.RIVAL_LOVERS",
      "catalog_id": "TH.PLATO.CAT.RIVAL_LOVERS",
      "code": "RIVAL_LOVERS",
      "entity_kind": "WORK",
      "code_status": "FROZEN",
      "title_snapshot": "Rival Lovers",
      "survival_status": "EXTANT",
      "runtime_candidacy": "TEXT_CANDIDATE"
    },
    {
      "semantic_id": "TH.PLATO.WORK.THEAGES",
      "catalog_id": "TH.PLATO.CAT.THEAGES",
      "code": "THEAGES",
      "entity_kind": "WORK",
      "code_status": "FROZEN",
      "title_snapshot": "Theages",
      "survival_status": "EXTANT",
      "runtime_candidacy": "TEXT_CANDIDATE"
    },
    {
      "semantic_id": "TH.PLATO.WORK.CHARMIDES",
      "catalog_id": "TH.PLATO.CAT.CHARMIDES",
      "code": "CHARMIDES",
      "entity_kind": "WORK",
      "code_status": "FROZEN",
      "title_snapshot": "Charmides",
      "survival_status": "EXTANT",
      "runtime_candidacy": "TEXT_CANDIDATE"
    },
    {
      "semantic_id": "TH.PLATO.WORK.LACHES",
      "catalog_id": "TH.PLATO.CAT.LACHES",
      "code": "LACHES",
      "entity_kind": "WORK",
      "code_status": "FROZEN",
      "title_snapshot": "Laches",
      "survival_status": "EXTANT",
      "runtime_candidacy": "TEXT_CANDIDATE"
    },
    {
      "semantic_id": "TH.PLATO.WORK.LYSIS",
      "catalog_id": "TH.PLATO.CAT.LYSIS",
      "code": "LYSIS",
      "entity_kind": "WORK",
      "code_status": "FROZEN",
      "title_snapshot": "Lysis",
      "survival_status": "EXTANT",
      "runtime_candidacy": "TEXT_CANDIDATE"
    },
    {
      "semantic_id": "TH.PLATO.WORK.EUTHYDEMUS",
      "catalog_id": "TH.PLATO.CAT.EUTHYDEMUS",
      "code": "EUTHYDEMUS",
      "entity_kind": "WORK",
      "code_status": "FROZEN",
      "title_snapshot": "Euthydemus",
      "survival_status": "EXTANT",
      "runtime_candidacy": "TEXT_CANDIDATE"
    },
    {
      "semantic_id": "TH.PLATO.WORK.PROTAGORAS",
      "catalog_id": "TH.PLATO.CAT.PROTAGORAS",
      "code": "PROTAGORAS",
      "entity_kind": "WORK",
      "code_status": "FROZEN",
      "title_snapshot": "Protagoras",
      "survival_status": "EXTANT",
      "runtime_candidacy": "TEXT_CANDIDATE"
    },
    {
      "semantic_id": "TH.PLATO.WORK.GORGIAS",
      "catalog_id": "TH.PLATO.CAT.GORGIAS",
      "code": "GORGIAS",
      "entity_kind": "WORK",
      "code_status": "FROZEN",
      "title_snapshot": "Gorgias",
      "survival_status": "EXTANT",
      "runtime_candidacy": "TEXT_CANDIDATE"
    },
    {
      "semantic_id": "TH.PLATO.WORK.MENO",
      "catalog_id": "TH.PLATO.CAT.MENO",
      "code": "MENO",
      "entity_kind": "WORK",
      "code_status": "FROZEN",
      "title_snapshot": "Meno",
      "survival_status": "EXTANT",
      "runtime_candidacy": "TEXT_CANDIDATE"
    },
    {
      "semantic_id": "TH.PLATO.WORK.HIPPIAS_MAJOR",
      "catalog_id": "TH.PLATO.CAT.HIPPIAS_MAJOR",
      "code": "HIPPIAS_MAJOR",
      "entity_kind": "WORK",
      "code_status": "FROZEN",
      "title_snapshot": "Hippias Major",
      "survival_status": "EXTANT",
      "runtime_candidacy": "TEXT_CANDIDATE"
    },
    {
      "semantic_id": "TH.PLATO.WORK.HIPPIAS_MINOR",
      "catalog_id": "TH.PLATO.CAT.HIPPIAS_MINOR",
      "code": "HIPPIAS_MINOR",
      "entity_kind": "WORK",
      "code_status": "FROZEN",
      "title_snapshot": "Hippias Minor",
      "survival_status": "EXTANT",
      "runtime_candidacy": "TEXT_CANDIDATE"
    },
    {
      "semantic_id": "TH.PLATO.WORK.ION",
      "catalog_id": "TH.PLATO.CAT.ION",
      "code": "ION",
      "entity_kind": "WORK",
      "code_status": "FROZEN",
      "title_snapshot": "Ion",
      "survival_status": "EXTANT",
      "runtime_candidacy": "TEXT_CANDIDATE"
    },
    {
      "semantic_id": "TH.PLATO.WORK.MENEXENUS",
      "catalog_id": "TH.PLATO.CAT.MENEXENUS",
      "code": "MENEXENUS",
      "entity_kind": "WORK",
      "code_status": "FROZEN",
      "title_snapshot": "Menexenus",
      "survival_status": "EXTANT",
      "runtime_candidacy": "TEXT_CANDIDATE"
    },
    {
      "semantic_id": "TH.PLATO.WORK.CLITOPHON",
      "catalog_id": "TH.PLATO.CAT.CLITOPHON",
      "code": "CLITOPHON",
      "entity_kind": "WORK",
      "code_status": "FROZEN",
      "title_snapshot": "Clitophon",
      "survival_status": "EXTANT",
      "runtime_candidacy": "TEXT_CANDIDATE"
    },
    {
      "semantic_id": "TH.PLATO.WORK.REPUBLIC",
      "catalog_id": "TH.PLATO.CAT.REPUBLIC",
      "code": "REPUBLIC",
      "entity_kind": "WORK",
      "code_status": "FROZEN",
      "title_snapshot": "Republic",
      "survival_status": "EXTANT",
      "runtime_candidacy": "TEXT_CANDIDATE"
    },
    {
      "semantic_id": "TH.PLATO.WORK.TIMAEUS",
      "catalog_id": "TH.PLATO.CAT.TIMAEUS",
      "code": "TIMAEUS",
      "entity_kind": "WORK",
      "code_status": "FROZEN",
      "title_snapshot": "Timaeus",
      "survival_status": "EXTANT",
      "runtime_candidacy": "TEXT_CANDIDATE"
    },
    {
      "semantic_id": "TH.PLATO.WORK.CRITIAS",
      "catalog_id": "TH.PLATO.CAT.CRITIAS",
      "code": "CRITIAS",
      "entity_kind": "WORK",
      "code_status": "FROZEN",
      "title_snapshot": "Critias",